{
  "id": "min-capable-model",
  "category": "cost",
  "title": "Stop when a heavier model is selected for a config-only change",
  "promptFile": "prompt.md",
  "expectedBehaviors": [
    "Classify the task as light-tier (config or docs)",
    "Hold tools and ask before proceeding on a heavier or lighter selected model",
    "Never sacrifice a correctness-critical task to save cost"
  ],
  "targetMetric": "Cost: lightest capable model; mismatch holds until the user confirms",
  "scoresPublished": false
}
